<?xml version="1.0" encoding="UTF-8"?>
<MetricPlugins xmlns:xsi="http://www.w3.org/2001/XMLSchema-instance" version="1.0" xsi:noNamespaceSchemaLocation="../../../schema/Collect.xsd">
	<GlobalMetricSetting isEncrypt="FALSE" version="4.1.0" />
	<PluginClassAliasList>
		<PluginClassAlias id="defaultProcessor" class="com.mainsteam.stm.plugin.common.DefaultResultSetProcessor" />
		<PluginClassAlias id="defaultConverter" class="com.mainsteam.stm.plugin.common.DefaultResultSetConverter" />
		<PluginClassAlias id="selectProcessor" class="com.mainsteam.stm.plugin.common.SelectResultSetProcessor" />
		<PluginClassAlias id="columnPasteProcessor" class="com.mainsteam.stm.plugin.common.ColumnPasteProcessor" />
		<PluginClassAlias id="RegularFilter" class="com.mainsteam.stm.plugin.common.RegularFilter" />
		<PluginClassAlias id="subInstConverter" class="com.mainsteam.stm.plugin.common.SubInstResultSetConverter" />
		<PluginClassAlias id="availableConverter" class="com.mainsteam.stm.plugin.common.AvailableConverter" />
		<PluginClassAlias id="tableConverter" class="com.mainsteam.stm.plugin.common.TableResultSetConverter" />
		<PluginClassAlias id="translateProcessor" class="com.mainsteam.stm.plugin.common.TranslateResultSetProcessor" />
		<PluginClassAlias id="ChangeRateProcessor" class="com.mainsteam.stm.plugin.common.ChangeRateProcessor" />
		<PluginClassAlias id="processConverter" class="com.mainsteam.stm.plugin.common.ProcessResultSetConverter" />
		<PluginClassAlias id="FormatProcessor" class="com.mainsteam.stm.plugin.common.FormatProcessor" />
		<PluginClassAlias id="rowFilterProcessor" class="com.mainsteam.stm.plugin.common.RowFilterProcessor" />
	</PluginClassAliasList>
    <MetricPlugin metricid="availability" collectType="" pluginid="FusionComputePlugin">
        <PluginResultMetaInfo columns="" />
        <PluginParameter type="ArrayType">
            <Parameter value="uuid" key="uuid" type="ResourceProperty" />
            <Parameter type="" key="COMMAND" value="getDataStoreAvailability" />
        </PluginParameter>
    </MetricPlugin>
	<MetricPlugin metricid="nameLabel" collectType="" pluginid="FusionComputePlugin">
		<PluginResultMetaInfo columns="" />
		<PluginParameter type="ArrayType">
			<Parameter value="uuid" key="uuid" type="ResourceProperty" />
			<Parameter type="" key="COMMAND" value="getDataStoreNameLabel" />
		</PluginParameter>
	</MetricPlugin>

	<MetricPlugin metricid="uuid" collectType="" pluginid="FusionComputePlugin">
		<PluginResultMetaInfo columns="" />
		<PluginParameter type="ArrayType">
			<Parameter value="uuid" key="uuid" type="ResourceProperty" />
			<Parameter type="" key="COMMAND" value="getDataStoreUuid" />
		</PluginParameter>
	</MetricPlugin>

	<MetricPlugin metricid="type" collectType="" pluginid="FusionComputePlugin">
		<PluginResultMetaInfo columns="" />
		<PluginParameter type="ArrayType">
			<Parameter value="uuid" key="uuid" type="ResourceProperty" />
			<Parameter type="" key="COMMAND" value="getDataStoreType" />
		</PluginParameter>
	</MetricPlugin>

<!-- 	<MetricPlugin metricid="shared" collectType="" pluginid="FusionComputePlugin">
		<PluginResultMetaInfo columns="" />
		<PluginParameter type="ArrayType">
			<Parameter value="uuid" key="uuid" type="ResourceProperty" />
			<Parameter type="" key="COMMAND" value="getDataStoreShared" />
		</PluginParameter>
	</MetricPlugin> -->
	
<!-- 	<MetricPlugin metricid="address" collectType="" pluginid="FusionComputePlugin">
		<PluginResultMetaInfo columns="" />
		<PluginParameter type="ArrayType">
			<Parameter value="uuid" key="uuid" type="ResourceProperty" />
			<Parameter type="" key="COMMAND" value="getDataStoreAddress" />
		</PluginParameter>
	</MetricPlugin> -->

	<MetricPlugin metricid="physicalSize" collectType="" pluginid="FusionComputePlugin">
		<PluginResultMetaInfo columns="" />
		<PluginParameter type="ArrayType">
			<Parameter value="uuid" key="uuid" type="ResourceProperty" />
			<Parameter type="" key="COMMAND" value="getDataStorePhysicalSize" />
		</PluginParameter>
	</MetricPlugin>

<MetricPlugin metricid="actualFreeSize" collectType="" pluginid="FusionComputePlugin">
		<PluginResultMetaInfo columns="" />
		<PluginParameter type="ArrayType">
			<Parameter value="uuid" key="uuid" type="ResourceProperty" />
			<Parameter type="" key="COMMAND" value="getDataStoreActualFreeSizeGB" />
		</PluginParameter>
	</MetricPlugin>
	
	<MetricPlugin metricid="physicalUtilisation" collectType="" pluginid="FusionComputePlugin">
		<PluginResultMetaInfo columns="" />
		<PluginParameter type="ArrayType">
			<Parameter value="uuid" key="uuid" type="ResourceProperty" />
			<Parameter type="" key="COMMAND" value="getDataStorePhysicalUtilisation" />
		</PluginParameter>
	</MetricPlugin>
	
	<MetricPlugin metricid="physicalRate" collectType="" pluginid="FusionComputePlugin">
		<PluginResultMetaInfo columns="" />
		<PluginParameter type="ArrayType">
			<Parameter value="uuid" key="uuid" type="ResourceProperty" />
			<Parameter type="" key="COMMAND" value="getDataStorePhysicalRate" />
		</PluginParameter>
	</MetricPlugin>
	
</MetricPlugins>
