<?xml version="1.0" encoding="UTF-8"?>
<MetricPlugins xmlns:xsi="http://www.w3.org/2001/XMLSchema-instance" version="1.0" xsi:noNamespaceSchemaLocation="../../../schema/Collect.xsd">
    <GlobalMetricSetting isEncrypt="FALSE" version="4.1.0"/>
    <PluginClassAliasList>
        <PluginClassAlias id="defaultProcessor" class="com.mainsteam.stm.plugin.common.DefaultResultSetProcessor"/>
        <PluginClassAlias id="defaultConverter" class="com.mainsteam.stm.plugin.common.DefaultResultSetConverter"/>
        <PluginClassAlias id="selectProcessor" class="com.mainsteam.stm.plugin.common.SelectResultSetProcessor"/>
        <PluginClassAlias id="columnPasteProcessor" class="com.mainsteam.stm.plugin.common.ColumnPasteProcessor"/>
        <PluginClassAlias id="RegularFilter" class="com.mainsteam.stm.plugin.common.RegularFilter"/>
        <PluginClassAlias id="subInstConverter" class="com.mainsteam.stm.plugin.common.SubInstResultSetConverter"/>
        <PluginClassAlias id="availableConverter" class="com.mainsteam.stm.plugin.common.AvailableConverter"/>
        <PluginClassAlias id="tableConverter" class="com.mainsteam.stm.plugin.common.TableResultSetConverter"/>
        <PluginClassAlias id="translateProcessor" class="com.mainsteam.stm.plugin.common.TranslateResultSetProcessor"/>
        <PluginClassAlias id="ChangeRateProcessor" class="com.mainsteam.stm.plugin.common.ChangeRateProcessor"/>
        <PluginClassAlias id="processConverter" class="com.mainsteam.stm.plugin.common.ProcessResultSetConverter"/>
        <PluginClassAlias id="FormatProcessor" class="com.mainsteam.stm.plugin.common.FormatProcessor"/>
        <PluginClassAlias id="rowFilterProcessor" class="com.mainsteam.stm.plugin.common.RowFilterProcessor"/>
    </PluginClassAliasList>

    <MetricPlugin metricid="availability" collectType="" pluginid="FusionComputePlugin">
        <PluginResultMetaInfo columns=""/>
        <PluginParameter type="ArrayType">
            <Parameter value="uuid" key="uuid" type="ResourceProperty"/>
            <Parameter type="" key="COMMAND" value="getClusterAvailability"/>
        </PluginParameter>
    </MetricPlugin>

    <MetricPlugin metricid="nameLabel" collectType="" pluginid="FusionComputePlugin">
        <PluginResultMetaInfo columns=""/>
        <PluginParameter type="ArrayType">
            <Parameter value="uuid" key="uuid" type="ResourceProperty"/>
            <Parameter type="" key="COMMAND" value="getClusterNameLabel"/>
        </PluginParameter>
    </MetricPlugin>

    <MetricPlugin metricid="uuid" collectType="" pluginid="FusionComputePlugin">
        <PluginResultMetaInfo columns=""/>
        <PluginParameter type="ArrayType">
            <Parameter value="uuid" key="uuid" type="ResourceProperty"/>
            <Parameter type="" key="COMMAND" value="getClusterUuid"/>
        </PluginParameter>
    </MetricPlugin>

    <MetricPlugin metricid="clusterName" collectType="" pluginid="FusionComputePlugin">
        <PluginResultMetaInfo columns=""/>
        <PluginParameter type="ArrayType">
            <Parameter value="uuid" key="uuid" type="ResourceProperty"/>
            <Parameter type="" key="COMMAND" value="getClusterName"/>
        </PluginParameter>
    </MetricPlugin>

    <MetricPlugin metricid="address" collectType="" pluginid="FusionComputePlugin">
        <PluginResultMetaInfo columns=""/>
        <PluginParameter type="ArrayType">
            <Parameter value="uuid" key="uuid" type="ResourceProperty"/>
            <Parameter type="" key="COMMAND" value="getClusterAddress"/>
        </PluginParameter>
    </MetricPlugin>

    <MetricPlugin metricid="totalCpuSize" collectType="" pluginid="FusionComputePlugin">
        <PluginResultMetaInfo columns=""/>
        <PluginParameter type="ArrayType">
            <Parameter value="uuid" key="uuid" type="ResourceProperty"/>
            <Parameter type="" key="COMMAND" value="getClusterTotalCpuSize"/>
        </PluginParameter>
    </MetricPlugin>

    <MetricPlugin metricid="usableCpuSize" collectType="" pluginid="FusionComputePlugin">
        <PluginResultMetaInfo columns=""/>
        <PluginParameter type="ArrayType">
            <Parameter value="uuid" key="uuid" type="ResourceProperty"/>
            <Parameter type="" key="COMMAND" value="getClusterUsableCpuSize"/>
        </PluginParameter>
    </MetricPlugin>

    <MetricPlugin metricid="obligateCpuSize" collectType="" pluginid="FusionComputePlugin">
        <PluginResultMetaInfo columns=""/>
        <PluginParameter type="ArrayType">
            <Parameter value="uuid" key="uuid" type="ResourceProperty"/>
            <Parameter type="" key="COMMAND" value="getClusterObligateCpuSize"/>
        </PluginParameter>
    </MetricPlugin>

    <MetricPlugin metricid="obligateCpuSizeRate" collectType="" pluginid="FusionComputePlugin">
        <PluginResultMetaInfo columns=""/>
        <PluginParameter type="ArrayType">
            <Parameter value="uuid" key="uuid" type="ResourceProperty"/>
            <Parameter type="" key="COMMAND" value="getClusterObligateCpuSizeRate"/>
        </PluginParameter>
    </MetricPlugin>


    <MetricPlugin metricid="totalMemSize" collectType="" pluginid="FusionComputePlugin">
        <PluginResultMetaInfo columns=""/>
        <PluginParameter type="ArrayType">
            <Parameter value="uuid" key="uuid" type="ResourceProperty"/>
            <Parameter type="" key="COMMAND" value="getClusterTotalMemSize"/>
        </PluginParameter>
    </MetricPlugin>

    <MetricPlugin metricid="usableMemSize" collectType="" pluginid="FusionComputePlugin">
        <PluginResultMetaInfo columns=""/>
        <PluginParameter type="ArrayType">
            <Parameter value="uuid" key="uuid" type="ResourceProperty"/>
            <Parameter type="" key="COMMAND" value="getClusterUsableMemSize"/>
        </PluginParameter>
    </MetricPlugin>

    <MetricPlugin metricid="obligateMemSize" collectType="" pluginid="FusionComputePlugin">
        <PluginResultMetaInfo columns=""/>
        <PluginParameter type="ArrayType">
            <Parameter value="uuid" key="uuid" type="ResourceProperty"/>
            <Parameter type="" key="COMMAND" value="getClusterObligateMemSize"/>
        </PluginParameter>
    </MetricPlugin>

    <MetricPlugin metricid="obligateMemSizeRate" collectType="" pluginid="FusionComputePlugin">
        <PluginResultMetaInfo columns=""/>
        <PluginParameter type="ArrayType">
            <Parameter value="uuid" key="uuid" type="ResourceProperty"/>
            <Parameter type="" key="COMMAND" value="getClusterObligateMemSizeRate"/>
        </PluginParameter>
    </MetricPlugin>

    <!-- 	<MetricPlugin metricid="sysUpTime" collectType="" pluginid="FusionComputePlugin">
            <PluginResultMetaInfo columns="" />
            <PluginParameter type="ArrayType">
                <Parameter value="uuid" key="uuid" type="ResourceProperty" />
                <Parameter type="" key="COMMAND" value="getClusterSysUpTime" />
            </PluginParameter>
        </MetricPlugin>	 -->

    <MetricPlugin metricid="cpuRate" collectType="" pluginid="FusionComputePlugin">
        <PluginResultMetaInfo columns=""/>
        <PluginParameter type="ArrayType">
            <Parameter value="uuid" key="uuid" type="ResourceProperty"/>
            <Parameter type="" key="COMMAND" value="getClusterCpuRate"/>
        </PluginParameter>
    </MetricPlugin>

    <MetricPlugin metricid="memRate" collectType="" pluginid="FusionComputePlugin">
        <PluginResultMetaInfo columns=""/>
        <PluginParameter type="ArrayType">
            <Parameter value="uuid" key="uuid" type="ResourceProperty"/>
            <Parameter type="" key="COMMAND" value="getClusterMemRate"/>
        </PluginParameter>
    </MetricPlugin>

    <!-- <MetricPlugin metricid="throughput" collectType="" pluginid="FusionComputePlugin">
        <PluginResultMetaInfo columns="" />
        <PluginParameter type="ArrayType">
            <Parameter value="uuid" key="uuid" type="ResourceProperty" />
            <Parameter type="" key="COMMAND" value="getClusterThroughput" />
        </PluginParameter>
    </MetricPlugin>	 -->

</MetricPlugins>
